{
  "format": "wpcheckpoint-archive",
  "format_version": 1,
  "required_features": [],
  "kind": "backup",
  "trigger": "manual",
  "created_at": "2026-09-18T10:00:00Z",
  "generator": {
    "name": "wp-checkpoint",
    "version": "0.1.0"
  },
  "site": {
    "home_url": "https://example.com",
    "site_url": "https://example.com",
    "abspath": "/var/www/html/",
    "content_dir": "/var/www/html/wp-content",
    "table_prefix": "wp_",
    "wp_version": "7.1",
    "php_version": "8.3.10",
    "db_server": "10.11.6-MariaDB",
    "multisite": false,
    "locale": "de_DE",
    "charset": "utf8mb4",
    "collate": "utf8mb4_unicode_520_ci"
  },
  "contents": {
    "database": true,
    "files": [
      "plugins",
      "themes",
      "uploads",
      "mu-plugins",
      "other-content"
    ]
  },
  "exclusions": [
    "wp-content/cache",
    "wp-content/wp-checkpoint-*"
  ],
  "hashing": {
    "algorithm": "sha256",
    "chunk_bytes": 16777216,
    "volume_chunk_bytes": 268435456
  },
  "database": {
    "index": {
      "path": "database.index.jsonl",
      "bytes": 84213,
      "sha256": "71812174732445a278ec1170a49881779638e0544874aa0559bd280d9486e0b3"
    },
    "tables": [
      {
        "name": "wp_posts",
        "rows": 12045,
        "bytes": 31864422,
        "chunks": 2,
        "sha256": "a7e850497d2e33cb3465a56de6b29759bf85c550d47c11b1c4672fb2d1556a7a"
      }
    ],
    "exported": {
      "started_at": "2026-09-18T09:40:00Z",
      "finished_at": "2026-09-18T09:58:12Z"
    }
  },
  "files": {
    "count": 18234,
    "bytes": 2143233211,
    "index": {
      "path": "files.index.jsonl",
      "bytes": 1843201,
      "sha256": "f11e0dade3b158e7bdeecbadbfcbd28ec9ff8dfcd051ec56ebb70edb5928ac6e"
    }
  },
  "volumes": [
    {
      "path": "example-20260918-100000-a1b2.part001.wpcheckpoint.zip",
      "bytes": 536870913,
      "chunks": [
        "3bfc269594ef649228e9a74bab00f042efc91d5acc6fbee31a382e80d42388fe",
        "fb04dcb6970e4c3d1873de51fd5a50d7bb46b3383113602665c350ec40b5f990",
        "e0d2747b9ab7abb6eb65e0373fa1b428a28bd6d8a2380106dcc080f58005ee14"
      ],
      "sha256": "81a7ef8824e9fc64ca81b84cd95ea5094fbd31e6637304d0706d6d7f757f586e"
    },
    {
      "path": "example-20260918-100000-a1b2.part002.wpcheckpoint.tar",
      "bytes": 4096,
      "sha256": "81db8ebbbbc69c6c6ad4a6aa92b76e0c08af547da236b9e2c9dbe1d8285a8130"
    }
  ],
  "encryption": null,
  "warnings": [
    "Views were not exported."
  ]
}
